{
  "schemaVersion": "1.0",
  "episode_id": "20260205-pbi-073-cache-invalidation",
  "created_at": "2026-02-05T16:42:00Z",
  "pbi_ref": { "type": "github", "id": "73" },
  "raw_intent": "Invalidate Redis cache on user profile update.",
  "summary": "Shipped successfully but a follow-up regression was detected 9 days later when stale cache surfaced in production; score decayed twice.",
  "detected": {
    "modules": ["cache", "services/users"],
    "contracts": [],
    "stacks": ["node", "redis"]
  },
  "embedding": {
    "model": "local-minilm-l6-v2@sha256-abc123def456abc123def456",
    "vector_ref": ".github/.episode-index/vectors.f32.bin#4608+1536"
  },
  "phases": [
    { "phase": "intake", "duration_ms": 1000, "token_cost": 400 },
    { "phase": "implement", "duration_ms": 4200, "token_cost": 1800 },
    { "phase": "review", "duration_ms": 1500, "token_cost": 600 },
    { "phase": "evidence", "duration_ms": 350, "token_cost": 120 }
  ],
  "outcome": "success",
  "outcome_score": 0.48,
  "score_components": { "tests": 0.8, "review": 1.0, "contract": 0.5, "rounds": 0.6 },
  "artifacts": {
    "spec": "specs/073-cache-invalidation/spec.md",
    "pr": "https://github.com/example/repo/pull/73",
    "evidence": ".artifacts/073/evidence-summary.md"
  },
  "regression_events": [
    { "at": "2026-02-14T08:00:00Z", "reason": "stale cache hit in prod on profile read", "detected_by": "ci" },
    { "at": "2026-02-18T12:00:00Z", "reason": "drift-detector flagged TTL mismatch", "detected_by": "drift-detector" }
  ],
  "replay_count": 2,
  "tags": ["cache", "regression"]
}
